{
  "event_id": "3f2c9d4e-5a6b-7c8d-9e0f-1a2b3c4d5e6f",
  "event_type": "activity.interval",
  "schema_version": 1,
  "owner_id": "owner",
  "source": {
    "kind": "android.usagestats",
    "record_id": "usage-session-tv.danmaku.bili-1754043000000"
  },
  "device": {
    "id": "pixel-8",
    "platform": "android"
  },
  "start_at": "2026-08-01T13:30:00.000Z",
  "end_at": "2026-08-01T14:05:00.000Z",
  "capture_timezone": "Asia/Shanghai",
  "capture_offset_minutes": 480,
  "privacy_level": "normal",
  "revision": 2,
  "finalization_state": "final",
  "provenance": {
    "collector_version": "0.1.0",
    "observed_at": "2026-08-01T14:20:00.000Z"
  },
  "invalidated": false,
  "payload": {
    "application_id": "tv.danmaku.bili",
    "application_label": "哔哩哔哩",
    "subject_id": "service:bilibili",
    "is_afk": false,
    "duration": {
      "value": 2100000,
      "unit": "ms"
    }
  }
}
